{"$schema":"https://json-schema.org/draft/2020-12/schema","$id":"assessment-record.schema.json","type":"object","additionalProperties":false,"required":["assessment_id","evidence_id","review_kind","reviewer","rubric_version","rubric_rows","decision","rationale","origin","created_at"],"properties":{"assessment_id":{"$ref":"common.schema.json#/$defs/id"},"evidence_id":{"$ref":"common.schema.json#/$defs/id"},"review_kind":{"enum":["self","independent"]},"reviewer":{"type":"object","additionalProperties":false,"required":["reviewer_id","display_name"],"properties":{"reviewer_id":{"type":"string","minLength":1,"maxLength":120},"display_name":{"type":"string","minLength":1,"maxLength":120}}},"rubric_version":{"type":"string","minLength":1,"maxLength":80},"rubric_rows":{"type":"array","minItems":10,"maxItems":10,"uniqueItems":true,"items":{"type":"object","additionalProperties":false,"required":["criterion_id","score","comment"],"properties":{"criterion_id":{"type":"string","minLength":1,"maxLength":80},"score":{"enum":[0,5,10]},"comment":{"type":"string","maxLength":4000}}}},"decision":{"enum":["meets","partially_meets","does_not_meet"]},"rationale":{"type":"string","minLength":1,"maxLength":20000},"origin":{"$ref":"common.schema.json#/$defs/origin"},"created_at":{"$ref":"common.schema.json#/$defs/time"}}}
