{"assessment_id":"33333333-3333-4333-8333-333333333333","evidence_id":"44444444-4444-4444-8444-444444444444","review_kind":"independent","reviewer":{"reviewer_id":"reviewer-01","display_name":"Independent reviewer"},"rubric_version":"intermediate-v1","rubric_rows":[{"criterion_id":"CR-01","score":10,"comment":"Met."},{"criterion_id":"CR-02","score":10,"comment":"Met."},{"criterion_id":"CR-03","score":10,"comment":"Met."},{"criterion_id":"CR-04","score":10,"comment":"Met."},{"criterion_id":"CR-05","score":10,"comment":"Met."},{"criterion_id":"CR-06","score":10,"comment":"Met."},{"criterion_id":"CR-07","score":10,"comment":"Met."},{"criterion_id":"CR-08","score":10,"comment":"Met."},{"criterion_id":"CR-09","score":10,"comment":"Met."},{"criterion_id":"CR-10","score":10,"comment":"Met."}],"decision":"meets","rationale":"The cited artifacts satisfy the named rubric checks.","origin":"locally_created","created_at":"2026-09-28T12:00:00.000Z"}
